{
  "template": "custom-assembly",
  "name": "induction-press",
  "triangleBudget": 12000,
  "renderResolution": 384,
  "renderSamples": 16,
  "recipe": {
    "schemaVersion": 1,
    "collisionTriangleBudget": 256,
    "lodTriangleBudget": 500,
    "materials": [
      {
        "id": "petrol-enamel",
        "color": [
          0.04,
          0.19,
          0.24
        ],
        "metallic": 0.3,
        "roughness": 0.36
      },
      {
        "id": "brushed-steel",
        "color": [
          0.65,
          0.7,
          0.76
        ],
        "metallic": 0.9,
        "roughness": 0.21
      },
      {
        "id": "orange-guard",
        "color": [
          0.7,
          0.2,
          0.04
        ],
        "metallic": 0.25,
        "roughness": 0.47
      },
      {
        "id": "status-green",
        "color": [
          0.06,
          0.6,
          0.14
        ],
        "metallic": 0.1,
        "roughness": 0.28,
        "emission": {
          "color": [
            0.03,
            0.4,
            0.06
          ],
          "strength": 1.3
        }
      }
    ],
    "parts": [
      {
        "name": "base-plinth",
        "role": "render",
        "geometry": {
          "kind": "box"
        },
        "dimensions": [
          1.6,
          1.1,
          0.16
        ],
        "position": [
          0,
          0,
          0.08
        ],
        "material": "petrol-enamel",
        "bevel": {
          "width": 0.015,
          "segments": 2
        }
      },
      {
        "name": "drive-housing",
        "role": "render",
        "geometry": {
          "kind": "box"
        },
        "dimensions": [
          0.9,
          0.75,
          0.8
        ],
        "position": [
          0,
          0.08,
          0.56
        ],
        "material": "petrol-enamel",
        "bevel": {
          "width": 0.025,
          "segments": 2
        }
      },
      {
        "name": "rear-upright",
        "role": "render",
        "geometry": {
          "kind": "box"
        },
        "dimensions": [
          0.18,
          0.55,
          1.35
        ],
        "position": [
          -0.52,
          0.08,
          0.835
        ],
        "material": "brushed-steel",
        "bevel": {
          "width": 0.012,
          "segments": 1
        }
      },
      {
        "name": "flywheel",
        "role": "render",
        "geometry": {
          "kind": "cylinder",
          "segments": 32
        },
        "dimensions": [
          0.62,
          0.62,
          0.18
        ],
        "position": [
          -0.53,
          -0.33,
          0.98
        ],
        "material": "brushed-steel",
        "rotationDegrees": [
          90,
          0,
          0
        ],
        "bevel": {
          "width": 0.008,
          "segments": 2
        }
      },
      {
        "name": "piston-shaft",
        "role": "render",
        "geometry": {
          "kind": "cylinder",
          "segments": 24
        },
        "dimensions": [
          0.12,
          0.12,
          0.5
        ],
        "position": [
          0.35,
          -0.22,
          1.24
        ],
        "material": "brushed-steel"
      },
      {
        "name": "crossbar",
        "role": "render",
        "geometry": {
          "kind": "box"
        },
        "dimensions": [
          1,
          0.14,
          0.12
        ],
        "position": [
          -0.05,
          -0.22,
          1.5
        ],
        "material": "petrol-enamel",
        "bevel": {
          "width": 0.008,
          "segments": 1
        }
      },
      {
        "name": "nozzle",
        "role": "render",
        "geometry": {
          "kind": "cone",
          "segments": 24
        },
        "dimensions": [
          0.18,
          0.18,
          0.22
        ],
        "position": [
          0.35,
          -0.22,
          0.85
        ],
        "material": "brushed-steel",
        "rotationDegrees": [
          180,
          0,
          0
        ]
      },
      {
        "name": "wedge-guard",
        "role": "render",
        "geometry": {
          "kind": "mesh",
          "vertices": [
            [
              -0.5,
              -0.5,
              -0.5
            ],
            [
              0.5,
              -0.5,
              -0.5
            ],
            [
              0.5,
              0.5,
              -0.5
            ],
            [
              -0.5,
              0.5,
              -0.5
            ],
            [
              -0.35,
              -0.5,
              0.5
            ],
            [
              0.35,
              -0.5,
              0.5
            ],
            [
              0.35,
              0.5,
              0.5
            ],
            [
              -0.35,
              0.5,
              0.5
            ]
          ],
          "indices": [
            3,
            2,
            1,
            3,
            1,
            0,
            4,
            5,
            6,
            4,
            6,
            7,
            0,
            1,
            5,
            0,
            5,
            4,
            1,
            2,
            6,
            1,
            6,
            5,
            2,
            3,
            7,
            2,
            7,
            6,
            3,
            0,
            4,
            3,
            4,
            7
          ]
        },
        "dimensions": [
          0.62,
          0.18,
          0.26
        ],
        "position": [
          0.33,
          -0.37,
          0.35
        ],
        "material": "orange-guard",
        "rotationDegrees": [
          0,
          0,
          12
        ]
      },
      {
        "name": "control-panel",
        "role": "render",
        "geometry": {
          "kind": "box"
        },
        "dimensions": [
          0.35,
          0.08,
          0.22
        ],
        "position": [
          0.24,
          -0.337,
          0.65
        ],
        "material": "orange-guard",
        "rotationDegrees": [
          12,
          0,
          0
        ],
        "bevel": {
          "width": 0.004,
          "segments": 1
        }
      },
      {
        "name": "status-lamp",
        "role": "render",
        "geometry": {
          "kind": "sphere",
          "segments": 16,
          "rings": 8
        },
        "dimensions": [
          0.07,
          0.03,
          0.07
        ],
        "position": [
          0.26,
          -0.392,
          0.66
        ],
        "material": "status-green"
      },
      {
        "name": "main-proxy",
        "role": "collision",
        "geometry": {
          "kind": "box"
        },
        "dimensions": [
          1.6,
          1.1,
          1.56
        ],
        "position": [
          0,
          0,
          0.78
        ]
      },
      {
        "name": "wheel-proxy",
        "role": "collision",
        "geometry": {
          "kind": "cylinder",
          "segments": 12
        },
        "dimensions": [
          0.64,
          0.64,
          0.2
        ],
        "position": [
          -0.53,
          -0.33,
          0.98
        ],
        "rotationDegrees": [
          90,
          0,
          0
        ]
      },
      {
        "name": "base-lod",
        "role": "lod1",
        "geometry": {
          "kind": "box"
        },
        "dimensions": [
          1.6,
          1.1,
          0.16
        ],
        "position": [
          0,
          0,
          0.08
        ],
        "material": "petrol-enamel"
      },
      {
        "name": "housing-lod",
        "role": "lod1",
        "geometry": {
          "kind": "box"
        },
        "dimensions": [
          0.9,
          0.75,
          0.8
        ],
        "position": [
          0,
          0.08,
          0.56
        ],
        "material": "petrol-enamel"
      },
      {
        "name": "upright-lod",
        "role": "lod1",
        "geometry": {
          "kind": "box"
        },
        "dimensions": [
          0.18,
          0.55,
          1.35
        ],
        "position": [
          -0.52,
          0.08,
          0.835
        ],
        "material": "brushed-steel"
      },
      {
        "name": "wheel-lod",
        "role": "lod1",
        "geometry": {
          "kind": "cylinder",
          "segments": 8
        },
        "dimensions": [
          0.62,
          0.62,
          0.18
        ],
        "position": [
          -0.53,
          -0.33,
          0.98
        ],
        "material": "brushed-steel",
        "rotationDegrees": [
          90,
          0,
          0
        ]
      },
      {
        "name": "piston-lod",
        "role": "lod1",
        "geometry": {
          "kind": "cylinder",
          "segments": 8
        },
        "dimensions": [
          0.12,
          0.12,
          0.5
        ],
        "position": [
          0.35,
          -0.22,
          1.24
        ],
        "material": "brushed-steel"
      },
      {
        "name": "bar-lod",
        "role": "lod1",
        "geometry": {
          "kind": "box"
        },
        "dimensions": [
          1,
          0.14,
          0.12
        ],
        "position": [
          -0.05,
          -0.22,
          1.5
        ],
        "material": "petrol-enamel"
      },
      {
        "name": "guard-lod",
        "role": "lod1",
        "geometry": {
          "kind": "mesh",
          "vertices": [
            [
              -0.5,
              -0.5,
              -0.5
            ],
            [
              0.5,
              -0.5,
              -0.5
            ],
            [
              0.5,
              0.5,
              -0.5
            ],
            [
              -0.5,
              0.5,
              -0.5
            ],
            [
              -0.35,
              -0.5,
              0.5
            ],